{
  "$schema": "https://json-schema.org/draft/2020-12/schema",
  "type": "object",
  "additionalProperties": false,
  "required": [
    "campaign_id",
    "run_id",
    "suite_id",
    "task_ids",
    "decoder_ids",
    "candidate_ids",
    "created_at",
    "mode"
  ],
  "properties": {
    "campaign_id": { "type": "string", "minLength": 1 },
    "run_id": { "type": "string", "minLength": 1 },
    "suite_id": { "type": "string", "minLength": 1 },
    "task_ids": {
      "type": "array",
      "minItems": 1,
      "items": { "type": "string", "minLength": 1 }
    },
    "decoder_ids": {
      "type": "array",
      "minItems": 1,
      "items": { "type": "string", "minLength": 1 }
    },
    "candidate_ids": {
      "type": "array",
      "items": { "type": "string", "minLength": 1 }
    },
    "created_at": {
      "type": "string",
      "pattern": "^\\d{4}-\\d{2}-\\d{2}T\\d{2}:\\d{2}:\\d{2}Z$"
    },
    "mode": { "enum": ["placeholder", "eval", "autoresearch"] },
    "tag": { "type": "string", "minLength": 1 },
    "wall_clock_seconds": { "type": "integer", "minimum": 1 },
    "seed": { "type": "integer" },
    "strategy": {
      "type": "object",
      "additionalProperties": false,
      "required": ["name", "params"],
      "properties": {
        "name": { "enum": ["grid", "random", "adaptive"] },
        "params": {
          "type": "object",
          "additionalProperties": {
            "anyOf": [
              { "type": "string" },
              { "type": "integer" },
              { "type": "number" },
              { "type": "boolean" },
              { "type": "null" }
            ]
          }
        }
      }
    }
  }
}
