{
  "campaign_id": "decoder-registry-css-bb-smoke",
  "candidate_ids": [
    "bivariate-bicycle-code-m6-n6"
  ],
  "created_at": "2026-06-16T18:40:24Z",
  "decoder_ids": [
    "rbposd-osd0-v1",
    "rbposd-osd10-v1",
    "predict-zero-v1"
  ],
  "mode": "eval",
  "run_id": "issue16-bb-css-validation",
  "suite_id": "decoder-registry-css-bb-smoke-v1",
  "task_ids": [
    "bb-css-memory-x-cdep-v1"
  ]
}
